clips	text
cefc-fleuron-V_Scol_endo_01_P4-45	ouais mais nous on pourra pas euh on pourra pas changer l'horaire
cefc-fleuron-V_Scol_endo_01_P4-38	donc ça on pourra pas
cefc-fleuron-V_Scol_endo_01_P4-61	ben moi c'est une option
cefc-fleuron-V_Scol_endo_01_P4-122	mais lui il pourra pas décider pour euh pour l'épreuve de musique à moins qu'il réussisse à convaincre
cefc-fleuron-V_Scol_endo_01_P4-108	sinon vous voyez
cefc-fleuron-V_Scol_endo_01_P4-11	oui oui
cefc-fleuron-V_Scol_endo_01_P4-25	j'ai été voir ma à huit heures
cefc-fleuron-V_Scol_endo_01_P4-97_2	ouais ouais
cefc-fleuron-V_Scol_endo_01_P4-21	non c'est écrit les deux les deux
cefc-fleuron-V_Scol_endo_01_P4-80	non c'est il y a que l'enseignant qui peut éventuellement décider de de déplacer euh de déplacer l'épreuve parce que pour les les terminaux écrits nous on peut absolument
cefc-fleuron-V_Scol_endo_01_P4-51	je vais retenter
cefc-fleuron-V_Scol_endo_01_P4-16	alors vous avez quoi comme épreuves
cefc-fleuron-V_Scol_endo_01_P4-50	mais je vais retourner le voir
cefc-fleuron-V_Scol_endo_01_P4-71	euh oui parce que
cefc-fleuron-V_Scol_endo_01_P4-117	monsieur NNAAMMEE
cefc-fleuron-V_Scol_endo_01_P4-35	non il est pas dans mon calendrier
cefc-fleuron-V_Scol_endo_01_P4-101	il y a pas sinon il y a pas un responsable vraiment de allemand euh
cefc-fleuron-V_Scol_endo_01_P4-46	parce que là c'est c'est pas de chance
cefc-fleuron-V_Scol_endo_01_P4-7	et ils m'ont tous répondu que ils ils envoyaient les mails à la scolarité
cefc-fleuron-V_Scol_endo_01_P4-28	ah ça j'ai pas noté
cefc-fleuron-V_Scol_endo_01_P4-77	lequel c'est je sais que c'est grammaire allemande
cefc-fleuron-V_Scol_endo_01_P4-89	mais ouais
cefc-fleuron-V_Scol_endo_01_P4-100	et il m'a dit qu'il pouvait rien faire
cefc-fleuron-V_Scol_endo_01_P4-31	et euh je sais plus si c'est huit heures ou huit heures et demie
cefc-fleuron-V_Scol_endo_01_P4-95	trente ouais ça on peut absolument pas le déplacer
cefc-fleuron-V_Scol_endo_01_P4-3	euh ouais et en fait c'est parce que j'ai un problème euh de date d'examen là
cefc-fleuron-V_Scol_endo_01_P4-49	ouais parce qu'ils m'ont tous dit qu'ils envoyaient un mail ici
cefc-fleuron-V_Scol_endo_01_P4-33	mais là c'est pas programmé dans le calendrier ça en musique
cefc-fleuron-V_Scol_endo_01_P4-41	il m'a dit de choisir entre les deux ouais
cefc-fleuron-V_Scol_endo_01_P4-88	quatre cent vingt-neuf de grammaire et traduction allemande
cefc-fleuron-V_Scol_endo_01_P4-74	sinon il y a grammaire et traduction ou grammaire S5
cefc-fleuron-V_Scol_endo_01_P4-113	donc euh lui pour lui c'est réglé
cefc-fleuron-V_Scol_endo_01_P4-126	et puis je vais envoyer un je vais renvoyer un mail à monsieur NNAAMMEE
cefc-fleuron-V_Scol_endo_01_P4-109	ouais bah il était anti-blocage
cefc-fleuron-V_Scol_endo_01_P4-125	monsieur NNAAMMEE là je pense qu'il est là
cefc-fleuron-V_Scol_endo_01_P4-15	euh oui votre numéro enfin ce sera plus simple
cefc-fleuron-V_Scol_endo_01_P4-60	comment c'est en L3 que euh
cefc-fleuron-V_Scol_endo_01_P4-17	qui qui se chevauchent
cefc-fleuron-V_Scol_endo_01_P4-1	excusez-moi je viens vous voir parce qu'en fait j'étais à la scolarité euh à l'autre où ils s'occupent des inscriptions
cefc-fleuron-V_Scol_endo_01_P4-124	ouais bah je vais je vais retourner voir
cefc-fleuron-V_Scol_endo_01_P4-110	et je suis pas venue en cours pendant le blocage
cefc-fleuron-V_Scol_endo_01_P4-13	dites-moi votre nom je vais regarder vos résultats d'abord
cefc-fleuron-V_Scol_endo_01_P4-23	c'est euh allemand
cefc-fleuron-V_Scol_endo_01_P4-94	et donc ça c'est une heure
cefc-fleuron-V_Scol_endo_01_P4-6	et et monsieur NNAAMMEE
cefc-fleuron-V_Scol_endo_01_P4-118	et puis ouais envoyez-lui un message expliquez-lui la situation
cefc-fleuron-V_Scol_endo_01_P4-123	monsieur monsieur NNAAMMEE après ils voient le problème entre eux retournez-vous voir monsieur NNAAMMEE
cefc-fleuron-V_Scol_endo_01_P4-84	c'est j'ai déjà envoyé des mails un mail au prof d'allemand
cefc-fleuron-V_Scol_endo_01_P4-119	ouais je lui ai déjà j'ai déjà fait
cefc-fleuron-V_Scol_endo_01_P4-52	mais vraiment il était pas du tout
cefc-fleuron-V_Scol_endo_01_P4-40	bah j'ai déjà demandé il veut pas
cefc-fleuron-V_Scol_endo_01_P4-24	donc jeudi on est le huit neuf dix
cefc-fleuron-V_Scol_endo_01_P4-47	si lui il veut pas changer l'horaire nous on pourra pas
cefc-fleuron-V_Scol_endo_01_P4-12	alors euh dites-moi
cefc-fleuron-V_Scol_endo_01_P4-131	OK bon bah merci bonne journée
cefc-fleuron-V_Scol_endo_01_P4-4	j'ai envoyé un mail à monsieur NNAAMMEE
cefc-fleuron-V_Scol_endo_01_P4-19	j'ai l'épreuve de musique et de d'allemand même temps
cefc-fleuron-V_Scol_endo_01_P4-97_1	et euh ouais
cefc-fleuron-V_Scol_endo_01_P4-112	donc déjà je suis fautive pour lui
cefc-fleuron-V_Scol_endo_01_P4-72	le dix septembre à huit heures euh
cefc-fleuron-V_Scol_endo_01_P4-54	ouais mais nous on peut pas quoi
cefc-fleuron-V_Scol_endo_01_P4-65	enfin j'ai choisi allemand parce que je suis culture et com donc
cefc-fleuron-V_Scol_endo_01_P4-107	si vous monsieur NNAAMMEE c'est sûr il a pas voulu euh
cefc-fleuron-V_Scol_endo_01_P4-39	donc ça il faudra voir euh en musique pour essayer de décaler l'horaire
cefc-fleuron-V_Scol_endo_01_P4-18	c'est le jeudi à huit heures
cefc-fleuron-V_Scol_endo_01_P4-87	le dix salle
cefc-fleuron-V_Scol_endo_01_P4-96	donc c'est c'est vraiment au responsable de faire un effort pour éventuellement vous convoquer un un autre jour parce que c'est un écrit aussi en en musique
cefc-fleuron-V_Scol_endo_01_P4-120	mais je vais lui je vais lui renvoyer un message pour lui dire euh
cefc-fleuron-V_Scol_endo_01_P4-105	tout ce que je peux
cefc-fleuron-V_Scol_endo_01_P4-64	en grammaire S5
cefc-fleuron-V_Scol_endo_01_P4-106	ouais et là culture com euh sinon vous voyez éventuellement euh
cefc-fleuron-V_Scol_endo_01_P4-9	c'est parce que j'ai deux examens en même temps fait
cefc-fleuron-V_Scol_endo_01_P4-99	et donc pour l'allemand j'ai envoyé un un mail à mon prof d'allemand du premier semestre
cefc-fleuron-V_Rint_03_P5-67	donc euh mh ces cours de français intensif euh donnent euh droit deux points pour euh une semaine et trois points de deux à trois semaines d'accord
cefc-fleuron-V_Rint_03_P5-6	mh mh si vous avez besoin vous les gardez
cefc-fleuron-V_Rint_03_P5-117	euh et on vous laisse un petit peu de temps pour faire le choix des cours
cefc-fleuron-V_Rint_03_P5-5	euh donc ici vous avez quatre certificats de scolarité
cefc-fleuron-V_Rint_03_P5-124	huit chercher la carte d'étudiant
cefc-fleuron-V_Rint_03_P5-22_2	je vous laisse la documentation
cefc-fleuron-V_Rint_03_P5-82	ah oui oui oui mais alors j'ai eu un souci avec le fax
cefc-fleuron-V_Rint_03_P5-58	voilà ces cours donnent euh droit des points ECTS
cefc-fleuron-V_Rint_03_P5-7	et puis euh on risque de vous de vous demander euh un des certificats
cefc-fleuron-V_Rint_03_P5-105	euh NNAAMMEE euh NNAAMMEE
cefc-fleuron-V_Rint_03_P5-40	c'est c'est bien parce que je pense que c'est une bonne une bonne chose pour vous
cefc-fleuron-V_Rint_03_P5-79	euh oui euh je vous ai laissé l'autre jour euh
cefc-fleuron-V_Rint_03_P5-112	elle donc qui qui vous aidera choisir les cours hein
cefc-fleuron-V_Rint_03_P5-128	voilà et demain vous euh l'accès à internet voilà
cefc-fleuron-V_Rint_03_P5-87	non c'est pas celui
cefc-fleuron-V_Rint_03_P5-127	bon merci beaucoup
cefc-fleuron-V_Rint_03_P5-109	vous pouvez attendre encore un petit peu
cefc-fleuron-V_Rint_03_P5-15	donc vous taperez étudiant étudiant
cefc-fleuron-V_Rint_03_P5-85	non ça c'est pas le vôtre
cefc-fleuron-V_Rint_03_P5-17	ensuite on vous demande euh l'identifiant qui correspond à votre login
cefc-fleuron-V_Rint_03_P5-23	d'accord merci
cefc-fleuron-V_Rint_03_P5-103	non on vous avait donné le nom
cefc-fleuron-V_Rint_03_P5-78	est-ce que vous avez des questions
cefc-fleuron-V_Rint_03_P5-129	d'accord merci
cefc-fleuron-V_Rint_03_P5-43	ça vous intéresse oui
cefc-fleuron-V_Rint_03_P5-28	vous suivez les cours de français intensif non du tout ça vous intéresse
cefc-fleuron-V_Rint_03_P5-110	il y a pas de problème euh mh hein
cefc-fleuron-V_Rint_03_P5-61	vous savez les points
cefc-fleuron-V_Rint_03_P5-48_1	je vais vous noter la date le lieu test avec monsieur le professeur NNAAMMEE
cefc-fleuron-V_Rint_03_P5-86	je sais que j'ai des fax qui étaient en attente
cefc-fleuron-V_Rint_03_P5-76	donc je vous remets ce papier
cefc-fleuron-V_Rint_03_P5-48_3	à quatorze heures
cefc-fleuron-V_Rint_03_P5-55	donc euh mh c'est pour ça que le test est obligatoire euh pour euh faire les les groupes les différents groupes mh euh et puis suite au test
cefc-fleuron-V_Rint_03_P5-90	oui euh j'avais un autre euh
cefc-fleuron-V_Rint_03_P5-59	vous avez euh quand vous suivez les cours de français intensif mh
cefc-fleuron-V_Rint_03_P5-92	mh si vous ne l'avez pas ici vous pouvez revenir demain après-midi
cefc-fleuron-V_Rint_03_P5-121	merci beaucoup euh
cefc-fleuron-V_Rint_03_P5-113	et puis euh bon ben pour l'instant vous pouvez donc suivre les cours de français
cefc-fleuron-V_Rint_03_P5-9	euh ici euh vous constatez que il n'y a pas de frais hein d'inscription
cefc-fleuron-V_Rint_03_P5-37	donc si vous voulez mh euh aller au cours la semaine prochaine ce serait bien il faudrait aller au test
cefc-fleuron-V_Rint_03_P5-68	voilà donc vous euh ben vous irez une semaine hein puisqu'après ça commence le lundi vingt-huit septembre
cefc-fleuron-V_Rint_03_P5-3	donc c'est le papier que vous apportez dans le bâtiment G en G zéro huit
cefc-fleuron-V_Rint_03_P5-14_1	je vais vous donner la documentation
cefc-fleuron-V_Rint_03_P5-98	je recommence demain matin
cefc-fleuron-V_Rint_03_P5-95	bon alors je vais noter celui-ci
cefc-fleuron-V_Rint_03_P5-69	d'accord merci
cefc-fleuron-V_Rint_03_P5-63	que vous avez quand vous passez des examens au premier semestre par semestre vous pouvez avoir trente points en général hein les étudiants erasmus
cefc-fleuron-V_Rint_03_P5-2	donc ce petit coupon je le garde pour moi
cefc-fleuron-V_Rint_03_P5-125	ils vous prennent en photo
cefc-fleuron-V_Rint_03_P5-34	euh jusqu'au vingt-cinq septembre
cefc-fleuron-V_Rint_03_P5-72	donc vous aurez droit deux points voilà
cefc-fleuron-V_Rint_03_P5-94	si vous avez d'accord
cefc-fleuron-V_Rint_03_P5-60	euh vous avez euh des points ECTS
cefc-fleuron-V_Rint_03_P5-35	monsieur NNAAMMEE qui est un professeur vous donnera donc euh des cours de de français
cefc-fleuron-V_Rint_03_P5-51	deux deux amphithéâtres zéro quarante-deux
cefc-fleuron-V_Rint_03_P5-84	alors je vais vérifier parce que le numéro euh mh
cefc-fleuron-V_Rint_03_P5-12	ce sont les salles informatiques où il y a les ordinateurs où vous pourrez euh faire l' votre accès pour internet
cefc-fleuron-V_Rint_03_P5-21	et ensuite vous validez encore et puis vous obtiendrez euh un autre euh un autre mot de un un autre mot de passe voilà
cefc-fleuron-V_Rint_03_P5-1	voici le papier
cefc-fleuron-V_Rint_03_P5-91	j'avais le numéro
cefc-fleuron-V_Rint_03_P5-123	pour voilà donc vous pouvez aller tout de suite dans le bâtiment G en G zéro
cefc-fleuron-V_Rint_03_P5-26	chercher votre carte
cefc-fleuron-V_Rint_03_P5-10	il n'y a aucun euh vous n'avancez pas vous ne payez pas
cefc-fleuron-V_Rint_03_P5-89	alors euh effectivement est-ce que vous avez un autre numéro de fax où je pourrais euh envoyer euh demain matin parce que euh mh on a fait plusieurs tentatives et euh ça ne fonctionnait pas
cefc-fleuron-V_Rint_03_P5-24	pour vous et puis maintenant donc vous pouvez aller en G
cefc-fleuron-V_Rint_03_P5-97	et puis euh je mh j'utiliserai ce numéro demain matin hein
cefc-fleuron-V_Rint_03_P5-75	activement les cours hein si vous êtes hum présente euh à tous les cours vous aurez euh effectivement les deux points
cefc-fleuron-V_Rint_03_P5-114	et puis effectivement la rentrée c'est donc le vingt-huit septembre
cefc-fleuron-V_Rint_03_P5-18	euh on vous demande également le numéro INEOBL ça
cefc-fleuron-V_Rint_03_P5-80	mon document de arrivée départ
cefc-fleuron-V_Rint_03_P5-52	mh ah d'accord
cefc-fleuron-V_Rint_03_P5-11	mh mh euh mh vous avez euh les salles qui sont notées sur ce coupon
cefc-fleuron-V_Rint_03_P5-81	pour euh l'envoyer par fax
cefc-fleuron-V_Rint_03_P5-65	mh mh euh ont trente points hein euh sur le contrat d'études
cefc-fleuron-V_Rint_03_P5-101	bien sinon vous avez vu votre professeur coordinateur non
cefc-fleuron-V_Rint_03_P5-66	on leur dit vous avez trente points euh
cefc-fleuron-V_Rint_03_P5-48_2	lundi vingt-et-un-septembre
cefc-fleuron-V_Rint_03_P5-83	euh j'ai des fax qui ne sont pas passés
cefc-fleuron-V_Rint_03_P5-42	et puis euh euh beaucoup beaucoup d'étudiants participent euh à ces cours
cefc-fleuron-V_Rint_03_P5-106	NNAAMMEE d'accord d'accord
cefc-fleuron-V_Rint_03_P5-20	vous voyez OBLT
cefc-fleuron-V_Rint_03_P5-56	vous pourrez euh participer euh aux cours le mardi vingt-deux jusqu'au vendredi vingt-cinq
cefc-fleuron-V_Rint_03_P5-41	ça vous permet d'améliorer le français
cefc-fleuron-V_Rint_03_P5-27	euh je voulais juste vous demander
cefc-fleuron-V_Rint_03_P5-33	parce que euh on organise euh pour les étudiants erasmus des cours euh spécifiques pour vous mh
cefc-fleuron-V_Rint_03_P5-36	les après-midis il y a un test qui est prévu lundi
cefc-fleuron-V_Rint_03_P5-49	amphithéâtre A zéro quarante-deux c'est juste l'amphithéâtre qui est à côté de mon bureau
cefc-fleuron-V_Rint_03_P5-19	correspond à celui-ci hein
cefc-fleuron-V_Rint_03_P5-53_2	c'est un test pour évaluer votre niveau de français parce qu'il y aura plusieurs groupes d'étudiants mh hein suivant les niveaux hein faible bon très
cefc-fleuron-V_Rint_03_P6-117	sinon vous avez d'autres questions
cefc-fleuron-V_Rint_03_P6-44	oui oui oui
cefc-fleuron-V_Rint_03_P6-93	mais peut-être que si voulez ouvrir un compte en banque on vous demandera un certificat
cefc-fleuron-V_Rint_03_P6-75	quand je vous demande de passer au bureau pour avoir des renseignements hein euh c'est important
cefc-fleuron-V_Rint_03_P6-30	donc euh vous savez qu'il faudra qu'on prendre contact avec elle hein puisque c'est elle qui vous conseillera pour les cours à prendre
cefc-fleuron-V_Rint_03_P6-46	alors vous êtes née le dix avril
cefc-fleuron-V_Rint_03_P6-47	mille neuf cent quatre-vingt-sept
cefc-fleuron-V_Rint_03_P6-33	vous allez l'avoir ce soir
cefc-fleuron-V_Rint_03_P6-121	pas encore vous irez au test lundi
cefc-fleuron-V_Rint_03_P6-45	donc NNAAMMEE
cefc-fleuron-V_Rint_03_P6-11	voilà juste la ville
cefc-fleuron-V_Rint_03_P6-131	voilà bien
cefc-fleuron-V_Rint_03_P6-22	hein c'est bien je vois que la carte s'arrête bien à la date euh parfait
cefc-fleuron-V_Rint_03_P6-9_2	euh et
cefc-fleuron-V_Rint_03_P6-10	où euh ici là-haut
cefc-fleuron-V_Rint_03_P6-6	apparemment oui oui oui tout me semble correct
cefc-fleuron-V_Rint_03_P6-94	euh ici euh vous avez les salles informatiques dans le bâtiment J qui est juste derrière vous en face de mon bureau bâtiment euh salle J zéro zéro
cefc-fleuron-V_Rint_03_P6-82	je vais imprimer le papier
cefc-fleuron-V_Rint_03_P6-84	votre université ne vous demande pas de papier d'attestion de présence qui dit que vous que vous êtes bien arrivée à l'université
cefc-fleuron-V_Rint_03_P6-111	et euh vous avez tout de suite la carte d'étudiante
cefc-fleuron-V_Rint_03_P6-118	tout non pas maintenant
cefc-fleuron-V_Rint_03_P6-138	à bientôt à bientôt
cefc-fleuron-V_Rint_03_P6-108	vous pouvez vous connecter d'accord
cefc-fleuron-V_Rint_03_P6-128	c'est bien comme ça c'est un test obligatoire
cefc-fleuron-V_Rint_03_P6-56	après l'adresse c'est Boudonville
cefc-fleuron-V_Rint_03_P6-101	je vous donne une documentation qui vous explique
cefc-fleuron-V_Rint_03_P6-69	deux moi j'envoie les informations
cefc-fleuron-V_Rint_03_P6-105	ensuite le numéro INE qui est ici vous validez puis vous avez un nouveau code
cefc-fleuron-V_Rint_03_P6-103	donc ici vous tapez étudiant étudiant
cefc-fleuron-V_Rint_03_P6-119	pas maintenant vous vous suivez les cours de français
cefc-fleuron-V_Rint_03_P6-3	donc euh j'ai ce dossier
cefc-fleuron-V_Rint_03_P6-129	euh et puis ainsi vous pourrez euh assister au cours euh tous les après-midis de la semaine prochaine
cefc-fleuron-V_Rint_03_P6-98	si vous avez des des problèmes de connexion il y a des informaticiens qui sont là dans la salle juste à côté
cefc-fleuron-V_Rint_03_P6-38	il y a des cybercafés quand vous avez pas la hein si vous voulez vraiment envoyer un message
cefc-fleuron-V_Rint_03_P6-42_2	c'est des signes polonais
cefc-fleuron-V_Rint_03_P6-92	euh donc vous les gardez pour l'instant
cefc-fleuron-V_Rint_03_P6-88	s'il y a besoin vous reviendrez me voir
cefc-fleuron-V_Rint_03_P6-34	et puis demain vous aurez l'accès à internet
cefc-fleuron-V_Rint_03_P6-76	je j'écrirai sur cette adresse l' l'adresse de l'université Nancy
cefc-fleuron-V_Rint_03_P6-28	mais j'ai pas j'ai pas écris pas encore
cefc-fleuron-V_Rint_03_P6-78	et c'est moi qui dois euh le créer ou
cefc-fleuron-V_Rint_03_P6-91	voici le document ici vous avez donc les quatre certificats de scolarité qui peuvent être utiles hein
cefc-fleuron-V_Rint_03_P6-136	bon merci merci
cefc-fleuron-V_Rint_03_P6-36	donc vous pourrez envoyer vos messages
cefc-fleuron-V_Rint_03_P6-110	donc maintenant vous pouvez aller dans le bâtiment G en G zéro huit on vous prend en photo hein plus besoin de photo d'identité
cefc-fleuron-V_Rint_03_P6-81	bien la saisie est terminée
cefc-fleuron-V_Rint_03_P6-58	ça va la chambre euh tout va
cefc-fleuron-V_Rint_03_P6-40	bien donc là je vais faire la saisie hein pour votre carte d'étudiante
cefc-fleuron-V_Rint_03_P6-7	juste me préciser la ville où vous êtes née c'est juste le de le renseignement qu'il me manque
cefc-fleuron-V_Rint_03_P6-114	G zéro huit
cefc-fleuron-V_Rint_03_P6-60	alors je prends l'adresse électronique
cefc-fleuron-V_Rint_03_P6-48	à W
cefc-fleuron-V_Rint_03_P6-107	ça fonctionnera demain demain
cefc-fleuron-V_Rint_03_P6-24	je vous avais donné le nom de votre professeur coordinateur
cefc-fleuron-V_Rint_03_P6-83	vingt-cinq NNAAMMEE c'est bon
cefc-fleuron-V_Rint_03_P6-130	d'accord vous m'avez dit donc euh
cefc-fleuron-V_Rint_03_P6-37	mais euh vous pouvez aussi aller au centre ville quand vous n'avez pas euh hein
cefc-fleuron-V_Rint_03_P6-25	oui je j'ai reçu des e-mails
cefc-fleuron-V_Rint_03_P6-74	donc il faudra bien regarder cette adresse
cefc-fleuron-V_Rint_03_P6-124	j'ai mis l'information sur lundi vingt-et-un
cefc-fleuron-V_Rint_03_P6-106	et euh vous avez l'accès à internet
cefc-fleuron-V_Rint_03_P6-100	vous avez votre login ici
cefc-fleuron-V_Rint_03_P6-26	ah elle a répondu madame NNAAMMEE
cefc-fleuron-V_Rint_03_P6-20	donc vous êtes là pour un semestre
cefc-fleuron-V_Rint_03_P6-97	vous pouvez vous connecter demain sur internet
cefc-fleuron-V_Rint_03_P6-55	NNAAMMEE vous êtes en résidence universitaire d'
cefc-fleuron-V_Rint_03_P6-5_2	je vais regarder je vais vous dire si c'est si c'est correctement rempli
cefc-fleuron-V_Rint_03_P6-79	non elle se fera automatiquement hein quand vous ferez la connexion à internet
cefc-fleuron-V_Rint_03_P6-122	euh oui le vingt-cinq
cefc-fleuron-V_Rint_03_P6-132	bon ben écoutez c'est parfait
cefc-fleuron-V_Rint_03_P6-133	bien ben vous pouvez aller chercher votre carte pour moi
cefc-fleuron-V_Rint_03_P6-4	mais je sais pas si c'est bien rempli
cefc-fleuron-V_Rint_03_P6-23	euh vous étudiez la psychologie
cefc-fleuron-V_Rint_03_P6-66	quinze WP point
cefc-fleuron-V_Rint_03_P6-50	ah alors j'ai juste mon petit code
cefc-fleuron-V_Rint_03_P6-102	comment vous devez procéder hein pour l'accès internet hein
cefc-fleuron-V_Rint_03_P6-51	ah LL hein
cefc-fleuron-V_Rint_03_P6-59	bien oui ça va
cefc-fleuron-V_Rint_03_P6-127	oui vous m'avez dit
cefc-fleuron-V_Rint_03_P6-104	OK vous retrouvez ici l'identifiant qui correspond à votre login euh
cefc-fleuron-V_Rint_03_P6-19	carte européenne très bien parfait
cefc-fleuron-V_Rint_03_P6-41	c'est un LSL d'accord merci pardon
cefc-fleuron-V_Rint_03_P6-14	oui j'ai également besoin des photocopies
cefc-fleuron-V_Rint_03_P6-32	oui vous l'aurez demain parce que je vais vous allez la carte d'étudiant
cefc-fleuron-V_Rint_03_P6-89	je vous ferai le papier d'accord
cefc-fleuron-V_Rint_03_P6-87	non non ben c'est parce que parfois l'université euh souhaite avoir un papier un justificatif euh qui dit que vous êtes bien arrivée euh au campus lettres
cefc-fleuron-V_Rint_03_P6-29	d'accord d'accord d'accord
cefc-fleuron-V_Scol_endo_01_P5-16	d'accord c'est en salle G huit G huit mh
cefc-fleuron-V_Scol_endo_01_P5-7	mais euh j'avais fait une demande bourse
cefc-fleuron-V_Scol_endo_01_P5-5	parce que je me suis déjà inscrite euh administrativement
cefc-fleuron-V_Scol_endo_01_P5-3	donc moi en fait je viens pour euh une bourse
cefc-fleuron-V_Scol_endo_01_P5-15	et après vous serez remboursée ultérieurement
cefc-fleuron-V_Scol_endo_01_P5-10_2	alors pour vous vous avez déjà payé vos droits
cefc-fleuron-V_Scol_endo_01_P5-11	non euh le les frais d'inscriptions je les ai réglés oui
cefc-fleuron-V_Scol_endo_01_P5-9	donc euh je l'ai reçue que maintenant et je ne sais pas quelle démarche il faut suivre euh
cefc-fleuron-V_Scol_endo_01_P5-10_1	hum hum
cefc-fleuron-V_Scol_endo_01_P5-14	euh donc euh il faut euh il faut retourner à la cellule web leur donner une copie de de la notification de bourse
cefc-fleuron-V_Rint_exo_06_P8-47	hein d'aller au restaurant universitaire euh sinon vous avez d'autres euh d'autres questions
cefc-fleuron-V_Rint_exo_06_P8-8	je vais vous dire
cefc-fleuron-V_Rint_exo_06_P8-79	euh jeudi après-midi plutôt parce que demain après-midi le bureau n'est pas ouvert euh aux étudiants l'après-midi pour jeudi après-midi sans problème on complètera le document
cefc-fleuron-V_Rint_exo_06_P8-76	le cer -~ certificat d'arrivée
cefc-fleuron-V_Rint_exo_06_P8-22	G zéro huit vous connaissez apparemment ici
cefc-fleuron-V_Rint_exo_06_P8-54	oui avec NNAAMMEE oui
cefc-fleuron-V_Rint_exo_06_P8-13	effectivement NNAAMMEE j'ai un document à vous remettre
cefc-fleuron-V_Rint_exo_06_P8-15	je vous donne donc le papier
cefc-fleuron-V_Rint_exo_06_P8-29	qui justifient que vous êtes bien étudiante euh à l'Université Nancy deux au campus lettres
cefc-fleuron-V_Rint_exo_06_P8-60	voici un exemple c'est le modèle en fait qu'il faut compléter
cefc-fleuron-V_Rint_exo_06_P8-28	toujours le lendemain les quatre certificats de scolarité hein
cefc-fleuron-V_Rint_exo_06_P8-41	oui bon c'est parfait
cefc-fleuron-V_Rint_exo_06_P8-69	c'est un document c'est pour moi
cefc-fleuron-V_Rint_exo_06_P8-35	donc je vous donne le document
cefc-fleuron-V_Rint_exo_06_P8-64	hein si une page ça ne suffit pas oui c'est oui et j'ai un contrat d'études
cefc-fleuron-V_Rint_exo_06_P8-45	on vous donne euh en échange une carte d'étudiant hein qui qui vous permettra d'aller à la bibliothèque euh
cefc-fleuron-V_Rint_exo_06_P8-23	donc vous avez les codes pour l'accès à internet
cefc-fleuron-V_Rint_exo_06_P8-14	donc ça c'est pour moi
cefc-fleuron-V_Rint_exo_06_P8-7	pour obtenir la carte d'étudiante peut-être dites-moi votre nom
cefc-fleuron-V_Rint_exo_06_P8-75	et hum demain est-ce que je peux revenir avec hum
cefc-fleuron-V_Rint_exo_06_P8-70	c'est pour pouvoir faire l'enregistrement
cefc-fleuron-V_Rint_exo_06_P8-32	une petite facture enfin qui dit vous n'avez pas payé de de frais hein
cefc-fleuron-V_Rint_exo_06_P8-58	pour les cours le voici NNAAMMEE est au courant hein puisque on a on a élaboré ce document ensemble
cefc-fleuron-V_Rint_exo_06_P8-30_1	oui oui hum hum
cefc-fleuron-V_Rint_exo_06_P8-85	oui merci
cefc-fleuron-V_Rint_exo_06_P8-56	tout NNAAMMEE NNAAMMEE d'accord d'accord c'est je vais peut-être vous donner par contre une euh un modèle pour de fiche pédagogique
cefc-fleuron-V_Rint_exo_06_P8-57	c'est-à-dire c'est le document que vous compléterez
cefc-fleuron-V_Rint_exo_06_P8-55	donc je pense que c'est
cefc-fleuron-V_Rint_exo_06_P8-48	et c'est
cefc-fleuron-V_Rint_exo_06_P8-26	internet fonctionnera euh demain hein parce que je l'ai fait ce matin
cefc-fleuron-V_Rint_exo_06_P8-62	donc je vous donne deux pages
cefc-fleuron-V_Rint_exo_06_P8-80	et puis on pourra l'envoyer
cefc-fleuron-V_Rint_exo_06_P8-68	mais ce document j'en aurai besoin pour enregistrer vos cours
cefc-fleuron-V_Rint_exo_06_P8-50	non j'ai organisé hum un rendez-vous avec hum
cefc-fleuron-V_Rint_exo_06_P8-17	hein pour aller chercher votre carte d'étudiant vous pourrez y aller tout de suite après en sortant du bureau
cefc-fleuron-V_Rint_exo_06_P8-82	ah oui jeudi oui oui
cefc-fleuron-V_Rint_exo_06_P8-2	bonjour hum hier l'autre femme a dit que je dois revenir pour avoir les documents
cefc-fleuron-V_Rint_exo_06_P8-36	vous allez donc au bâtiment G
cefc-fleuron-V_Rint_exo_06_P8-53	avec votre professeur coordinateur
cefc-fleuron-V_Rint_exo_06_P8-38	et on vous donne la petite carte ce soir
cefc-fleuron-V_Rint_exo_06_P8-61	euh moi j'en aurai besoin pour enregistrer vos cours
cefc-fleuron-V_Rint_exo_06_P8-65	vous me l'en-
cefc-fleuron-V_Rint_exo_06_P8-66	oui mais oui oui oui vous ferez signer par NNAAMMEE votre contrat d'études
cefc-fleuron-V_Rint_exo_06_P8-37	on vous prend en photo
cefc-fleuron-V_Rint_exo_06_P8-44	tout juste ce papier on vous prend photo
cefc-fleuron-V_Rint_03_P7-44	donc ce n'est plus du tout le programme
cefc-fleuron-V_Rint_03_P7-62	par euh par d'autres par un autre support voilà ouais
cefc-fleuron-V_Rint_03_P7-143	et vous pouvez vous pouvez me donner en fait l'adresse exacte hum
cefc-fleuron-V_Rint_03_P7-60	la possibilité de partir à l'étranger
cefc-fleuron-V_Rint_03_P7-21	étudiants européens ouais
cefc-fleuron-V_Rint_03_P7-123	madame NNAAMMEE vous savez où se trouve euh le bureau des relations internationales
cefc-fleuron-V_Rint_03_P7-66	mais après cest vrai que ça va être euh
cefc-fleuron-V_Rint_03_P7-83	euh hein en attribuant des bourses euh
cefc-fleuron-V_Rint_03_P7-136	hein lui dire euh voilà j'aimerais partir à l'étranger
