clips	text
cefc-fleuron-V_Defle_endo_05_P5-11	donc euh vous êtes déjà de de quelle nationalité
cefc-fleuron-V_Defle_endo_05_P5-163	deux mille sept deux mille sept deux mille huit
cefc-fleuron-V_Defle_endo_05_P5-12	vénézuélien vénézuélien
cefc-fleuron-V_Defle_exo_05_P1-1	donc euh je vous donne ça déjà
cefc-fleuron-V_Defle_exo_05_P1-2	c'est pour les trois cent quatre-vingt-dix-neuf euros cinquante-sept
cefc-fleuron-V_Defle_exo_05_P1-12	et donc euh vous pourriez vérifier votre nom prénom date de naissance si j'ai pas fait une erreur
cefc-fleuron-V_Defle_exo_05_P1-4	et vous avez l'attestation d'affiliation pour la sécurité sociale hein
cefc-fleuron-V_Defle_exo_05_P1-6	faudra y aller pour avoir la carte vitale hein
cefc-fleuron-V_Defle_exo_05_P1-14	bon là je vais vous faire l'autre justificatif pour les pour les sept cents euros là
cefc-fleuron-V_Defle_exo_05_P1-5	donc il faudra aller à la MGEL pour avoir la carte
cefc-fleuron-V_Defle_exo_05_P1-3	donc vous avez quatre certificats de scolarité
cefc-fleuron-V_Rint_exo_06_P4-4	c'est bien tout se passe bien
cefc-fleuron-V_Rint_exo_06_P4-20	j'essaie de faire vite aussi
cefc-fleuron-V_Rint_exo_06_P4-62	merci merci beaucoup
cefc-fleuron-V_Rint_exo_06_P4-51	ça va
cefc-fleuron-V_Rint_exo_06_P4-64	bonne fin d'après-midi
cefc-fleuron-V_Rint_exo_06_P4-15	je pense que vous aurez encore le temps d'aller la chercher dans le bâtiment G
cefc-fleuron-V_Rint_exo_06_P4-10	je comprends oui
cefc-fleuron-V_Rint_exo_06_P4-8	euh en fait c'est une partie de la carte d'identité
cefc-fleuron-V_Rint_exo_06_P4-17	le bureau sera encore ouvert
cefc-fleuron-V_Rint_exo_06_P4-38	hum hum ouais je sais
cefc-fleuron-V_Rint_exo_06_P4-41	et puis là vous gardez pour vous hein ce papier
cefc-fleuron-V_Rint_exo_06_P4-9	et c'est la deuxième
cefc-fleuron-V_Rint_exo_06_P4-56	si j'ai des questions euh
cefc-fleuron-V_Rint_exo_06_P4-37	c'est juste le bâtiment qui est derrière vous votre login votre numéro INE
cefc-fleuron-V_Rint_exo_06_P4-63	de rien à bientôt
cefc-fleuron-V_Rint_exo_06_P4-36	si vous avez besoin de justifier que vous êtes étudiante à l'Université de Nancy deux ici vous avez les salles informatiques des ordinateurs à disposition
cefc-fleuron-V_Rint_exo_06_P4-48	et puis vous avez votre carte
cefc-fleuron-V_Rint_exo_06_P4-45	donc vous pouvez aller tout de suite hein parce que c'est encore ouvert le bureau en G zéro huit
cefc-fleuron-V_Rint_exo_06_P4-27	vous êtes en résidence universitaire oui à Boudonville
cefc-fleuron-V_Rint_exo_06_P4-3	seize heures bah très bien parfait il y a même cinq minutes d'avance
cefc-fleuron-V_Rint_exo_06_P4-14	j'ai retenu le code
cefc-fleuron-V_Rint_exo_06_P4-25	ainsi vous aurez l'accès à internet euh demain
cefc-fleuron-V_Rint_exo_06_P4-5	et les copies oui
cefc-fleuron-V_Rint_exo_06_P4-52	oui vous me dites vous avez
cefc-fleuron-V_Rint_exo_06_P4-6	et les copies oui
cefc-fleuron-V_Rint_exo_06_P4-35	vous avez les quatre certificats de scolarité
cefc-fleuron-V_Rint_exo_06_P4-13	alors donc Pologne je crois que c'est cent vingt-deux ouais bien
cefc-fleuron-V_Rint_exo_06_P4-54	ouais ça va j'ai compris
cefc-fleuron-V_Rint_exo_06_P4-65	à bientôt bon après-midi
cefc-fleuron-V_Rint_exo_06_P4-42	ça indique vous n'avez pas payé de de de frais
cefc-fleuron-V_Rint_exo_06_P4-46	donc chercher votre carte
cefc-fleuron-V_Rint_exo_06_P4-29	oui ça va merci
cefc-fleuron-V_Rint_exo_06_P4-58	ah si vous avez des questions vous me les poserez toujours
cefc-fleuron-V_Rint_exo_06_P4-31	en en salle G zéro euh huit
cefc-fleuron-V_Rint_exo_06_P4-30	donc je vais avec ce papier
cefc-fleuron-V_Rint_exo_06_P4-11	j'ai bien compris j'accepte quand même
cefc-fleuron-V_Defle_exo_05_P2-44	elle non mais elle peut faire une inscription parce qu'elle a
cefc-fleuron-V_Defle_exo_05_P2-87	ah si on peut ouais on peut te faxer
cefc-fleuron-V_Defle_exo_05_P2-78	hum oui mais visiter ou étudier aussi
cefc-fleuron-V_Defle_exo_05_P2-72	c'est les fonctionnaires qui ont ce passeport
cefc-fleuron-V_Defle_exo_05_P2-59	mais je enfin faudra que je me renseigne auprès de la préfecture hein
cefc-fleuron-V_Defle_exo_05_P2-51	le deuxième semestre reprend le dix-huit janvier
cefc-fleuron-V_Defle_exo_05_P2-119	euh oui alors il faudrait que je vois et que je téléphone à la à la préfecture
cefc-fleuron-V_Defle_exo_05_P2-90	mais c'est un passeport euh
cefc-fleuron-V_Defle_exo_05_P2-110	ah vous avez déjà une pré-inscription oui
cefc-fleuron-V_Defle_exo_05_P2-85	bah il me faudrait euh vous n'avez pas la photocopie de son passeport euh
cefc-fleuron-V_Defle_exo_05_P2-84	si nous si on repasse dans la semaine c'est euh on peut
cefc-fleuron-V_Defle_exo_05_P2-68	c'est un passeport diplomatique
cefc-fleuron-V_Defle_exo_05_P2-14	ou c'est une inscription
cefc-fleuron-V_Defle_exo_05_P2-35	parce que vous me dites euh
cefc-fleuron-V_Defle_exo_05_P2-122	parce que on vous nous on vous le ramène ce sera mieux hein le passeport
cefc-fleuron-V_Defle_exo_05_P2-126	donc ça s'appelle un
cefc-fleuron-V_Defle_exo_05_P2-46	vous me dites que c'était pour trois trois mois
cefc-fleuron-V_Defle_exo_05_P2-104	parce que ce serait pour le premier semestre pour tout de suite
cefc-fleuron-V_Defle_exo_05_P2-6	France elle est elle est de quelle nationalité
cefc-fleuron-V_Defle_exo_05_P2-11	elle peut rentrer en France parce qu'elle a un passeport vert
cefc-fleuron-V_Defle_exo_05_P2-37	elle veut venir pour un semestre parce que nous les cours
cefc-fleuron-V_Defle_exo_05_P2-10	elle elle va rentrer en France
cefc-fleuron-V_Defle_exo_05_P2-114	son passeport c'est un passeport vert
cefc-fleuron-V_Defle_exo_05_P2-103	en fait j'ai eu déjà un pré-inscription pour eux pour elle
cefc-fleuron-V_Defle_exo_05_P2-112	parce que moi ce que j'aimerais bien voir c'est c'est son passeport
cefc-fleuron-V_Defle_exo_05_P2-53	c'est dix-huit jan
cefc-fleuron-V_Defle_exo_05_P2-70	en fait c'est parce ouais en fait avec passeport
cefc-fleuron-V_Defle_exo_05_P2-21	attendez je vais vous je vais vous donner des tarifs
cefc-fleuron-V_Defle_exo_05_P2-76	de toute façon
cefc-fleuron-V_Defle_exo_05_P2-18	quand elle peut cette semaine elle peut venir ouais
cefc-fleuron-V_Defle_exo_05_P2-99	bah je préfère me renseigner déjà auprès de la préfecture hein
cefc-fleuron-V_Defle_exo_05_P2-64	si vous me dites que parce que c'est quoi un passeport
cefc-fleuron-V_Defle_exo_05_P2-92	d'accord on vous faxe
cefc-fleuron-V_Defle_exo_05_P2-102	vous avez un stylo
cefc-fleuron-V_Defle_exo_05_P2-19	cette semaine parce qu'on le DEFLE propose des cours à la carte
cefc-fleuron-V_Defle_exo_05_P2-101	quand bah vous allez me mettre son nom
cefc-fleuron-V_Defle_exo_05_P2-32	parce qu'on a des cours à la carte
cefc-fleuron-V_Defle_exo_05_P2-29	si en fait nous nous nous ce qu'on veut c'est inscription annuelle
cefc-fleuron-V_Defle_exo_05_P2-123	sinon ça sert ça sert à rien ça
cefc-fleuron-V_Defle_exo_05_P2-23	on a déjà des tarifs
cefc-fleuron-V_Defle_exo_05_P2-55	mais on voudrait bien savoir elle peut inscrire ici sans visa parce qu'elle a un passeport
cefc-fleuron-V_Defle_exo_05_P2-137	ouais ouais cet aprem on en ce sera faxé demain on repasse OK merci
cefc-fleuron-V_Defle_exo_05_P2-47	ouais donc là les cours ont commencé quatorze septembre
cefc-fleuron-V_Defle_exo_05_P2-96	ouais il y a c'est-à-dire que elle peut réaliser son inscription
cefc-fleuron-V_Defle_exo_05_P2-113	hum mais on vous on vous le faxe on
cefc-fleuron-V_Defle_exo_05_P2-108	si si c'est possible
cefc-fleuron-V_Defle_exo_05_P2-73	ils peuvent visiter tous les pays
cefc-fleuron-V_Defle_exo_05_P2-24	oh mon e ami il a déjà il a déjà les tarifs
cefc-fleuron-V_Defle_exo_05_P2-43	elle peut faire une
cefc-fleuron-V_Defle_exo_05_P2-74	ils ont pas visiter ou vivre étudier aussi
cefc-fleuron-V_Defle_exo_05_P2-17	euh elle va arriver en France
cefc-fleuron-V_Defle_exo_05_P2-9	et ouais elle peut
cefc-fleuron-V_Defle_exo_05_P2-26	parce qu'elle ne veut pas de carte d'étudiant
cefc-fleuron-V_Defle_exo_05_P2-50	dix-huit décembre d'accord
cefc-fleuron-V_Defle_exo_05_P2-125	ben oui vous me le rapportez et puis je téléphonerai à la préfecture
cefc-fleuron-V_Defle_exo_05_P2-100	d'alors on vient
cefc-fleuron-V_Defle_exo_05_P2-52	et se termine le quatorze mai
cefc-fleuron-V_Defle_exo_05_P2-33	ah oui alors les cours les cours à la carte
cefc-fleuron-V_Defle_exo_05_P2-116	oui mais euh comment est le visa
cefc-fleuron-V_Defle_exo_05_P2-93	et comme ça on a la réponse claire précise
cefc-fleuron-V_Defle_exo_05_P2-77	étudier on sait pas parce que elle peut rester que trois mois
cefc-fleuron-V_Defle_exo_05_P2-13	mais pour trois mois est-ce que pour ces trois mois elle peut s'inscrire à la
cefc-fleuron-V_Defle_exo_05_P2-3	j'ai une amie euh
cefc-fleuron-V_Defle_exo_05_P2-105	pour pour une année
cefc-fleuron-V_Defle_exo_05_P2-41	attendez voir les dates
cefc-fleuron-V_Defle_exo_05_P2-38	ont commencé du quatorze septembre
cefc-fleuron-V_Defle_exo_05_P2-56	j'espère qu'elle peut venir ici sans visa
cefc-fleuron-V_Defle_exo_05_P2-58	bah il me semble que j'ai déjà fait
cefc-fleuron-V_Defle_exo_05_P2-111	nous ce qu'on veut c'est pré-inscription euh inscription à la annuelle
cefc-fleuron-V_Defle_exo_05_P2-134	mh donc vous repassez quand euh demain
cefc-fleuron-V_Defle_exo_05_P2-131	vous revenez avec le passeport
cefc-fleuron-V_Defle_exo_05_P2-8	oui elle est dans son pays
cefc-fleuron-V_Defle_exo_05_P2-83	bah il faudrait que je me renseigne auprès de la la préfecture hein
cefc-fleuron-V_Defle_exo_05_P2-57	on peut tenter ça
cefc-fleuron-V_Defle_exo_05_P2-54	quatorze mai d'accord
cefc-fleuron-V_Defle_exo_05_P2-91	ouais et puis je téléphonerai à la préfecture hein pour savoir
cefc-fleuron-V_Defle_exo_05_P2-62	ici est-ce que elle peut inscire ici sans visa
cefc-fleuron-V_Defle_exo_05_P2-67	un passeport autorisé de venir n'importe quel pays Europe Union Européenne voilà sans visa
cefc-fleuron-V_Defle_exo_05_P2-66	dans votre établissement passeport spécial
cefc-fleuron-V_Defle_exo_05_P2-2	c'était pour un renseignement en fait
cefc-fleuron-V_Defle_exo_05_P2-34	il y a pas de de carte d'étudiant
cefc-fleuron-V_Defle_exo_05_P2-48	donc ils finissent le dix-huit décembre
cefc-fleuron-V_Defle_exo_05_P2-109	oui pour tout de suite normalement j'ai déjà pré-inscription oui pour elle oui pour elle voilà
cefc-fleuron-V_Rint_exo_06_P5-10	parce que je suis allée OK
cefc-fleuron-V_Rint_exo_06_P5-89	c'est c'est vrai que oui elle a bien fait de vous poser cette question parce que
cefc-fleuron-V_Rint_exo_06_P5-56	ah oui non mais c'est normal parce que hein hein vous avez le temps de découvrir
cefc-fleuron-V_Rint_exo_06_P5-98	vous n'avez pas payé de frais de euh hein pour la carte SIUAPS voilà
cefc-fleuron-V_Rint_exo_06_P5-105	non non il y a pas c'est sans rendez-vous
cefc-fleuron-V_Rint_exo_06_P5-13	et on a décidé sur sur certains cours
cefc-fleuron-V_Rint_exo_06_P5-42	et puis moi c'est le document que je vous demande parce que j'en ai besoin pour faire l'enregistrement de vos cours
cefc-fleuron-V_Rint_exo_06_P5-103	à bientôt ça non non non non non non vous venez
cefc-fleuron-V_Rint_exo_06_P5-4	la fiche pédagogique c'est la fiche où on indique les cours qui sont choisis
cefc-fleuron-V_Rint_exo_06_P5-54	pour découvrir un petit peu les on vous laisse le temps hein de découvrir les cours
cefc-fleuron-V_Rint_exo_06_P5-100	bien voilà donc euh c'est tout merci
cefc-fleuron-V_Rint_exo_06_P5-90	les étudiants français
cefc-fleuron-V_Rint_exo_06_P5-71	et j'ai une autre petite question
cefc-fleuron-V_Rint_exo_06_P5-1	à propos de euh la fiche pédagogique c'est ça
cefc-fleuron-V_Rint_exo_06_P5-18	c'est vrai que euh je ne voulais pas vous donner trop de documents au début
cefc-fleuron-V_Rint_exo_06_P5-57	il y a il y a beaucoup de cours qui peuvent vous intéresser
cefc-fleuron-V_Rint_exo_06_P5-11	ça je l'ai pas encore
cefc-fleuron-V_Rint_exo_06_P5-62	et il faut sa signature
cefc-fleuron-V_Rint_exo_06_P5-20	oui je comprends tout à fait
cefc-fleuron-V_Rint_exo_06_P5-88	il faut les payer à part
cefc-fleuron-V_Rint_exo_06_P5-96	mais pour vous c'est c'est vrai que c'est différent
cefc-fleuron-V_Rint_exo_06_P5-16	et elle m'a demandé de venir chercher le la fiche oui
cefc-fleuron-V_Rint_exo_06_P5-59	donc voilà le document euh hein donc elle vous disait
cefc-fleuron-V_Rint_exo_06_P5-97	donc là moi je n'ai pas payé de
cefc-fleuron-V_Rint_exo_06_P5-63	signé signé oui la signature de de NNAAMMEE
cefc-fleuron-V_Rint_exo_06_P5-61	et puis je vais vous rendre ça
cefc-fleuron-V_Rint_exo_06_P5-12	et j'ai parlé à madame NNAAMMEE
cefc-fleuron-V_Rint_exo_06_P5-73	euh je suis allée chercher ma carte SIUAP SIUAPS
cefc-fleuron-V_Rint_exo_06_P5-30	hein elle elle est en train de faire un document pour qui vous aide vous les étudiants erasmus pour choisir vos cours parce que c'est pas facile
cefc-fleuron-V_Rint_exo_06_P5-24	mais maintenant c'est vrai que je peux vous le donner
cefc-fleuron-V_Rint_exo_06_P5-39	oh oui oui elle est vraiment
cefc-fleuron-V_Rint_exo_06_P5-75	oui aujourd'hui mais j'avais pas le certificat de scolarité sur moi
cefc-fleuron-V_Rint_exo_06_P5-17	la fiche oui oui je vais vous la donner
cefc-fleuron-V_Rint_exo_06_P5-19	parce que ça fait beaucoup de documents euh pour vous vous arrivez beaucoup de papiers
cefc-fleuron-V_Rint_exo_06_P5-99	OK alors c'était
cefc-fleuron-V_Rint_exo_06_P5-50	si ce qui m'intéresse
cefc-fleuron-V_Rint_exo_06_P5-49	oui elle m'a dit elle m'a dit de venir euh ou d'aller la première semaine pour voir
cefc-fleuron-V_Rint_exo_06_P5-91	euh ont la possibilité de payer
cefc-fleuron-V_Rint_exo_06_P5-101	mais de rien il faut faire un rendez-vous pour ça
cefc-fleuron-V_Rint_exo_06_P5-79	ah oui euh non il faut dire non non non non oui oui
cefc-fleuron-V_Rint_exo_06_P5-46	pas tout de suite hein c'est moi c'est moi qui enregistre les pas tout de suite hein au mois d'octobre hein
cefc-fleuron-V_Rint_exo_06_P5-77	et ils m'ont demandé si j'ai déjà payé les frais de sport
cefc-fleuron-V_Rint_exo_06_P5-37	oui elle m'a envoyé un plein de emails
cefc-fleuron-V_Rint_exo_06_P5-69	la vôtre aussi et puis c'est tout en fait hein
cefc-fleuron-V_Rint_exo_06_P5-86	oui oui oui oui oui non non non on n'a pas payé les
cefc-fleuron-V_Rint_exo_06_P5-27	vous avez l'ensemble hein des cours à indiquer avec les codes avec le code du cours
cefc-fleuron-V_Rint_exo_06_P5-41	donc euh vous indiquerez bien tous les codes
cefc-fleuron-V_Rint_exo_06_P5-87	oui non non c'est en fait
cefc-fleuron-V_Rint_exo_06_P5-106	OK super merci beaucoup bonne journée
cefc-fleuron-V_Rint_exo_06_P5-32	en plusieurs UFR c'est assez
cefc-fleuron-V_Rint_exo_06_P5-81	OK j'ai dit non
cefc-fleuron-V_Rint_exo_06_P5-40	oui oui vraiment vraiment vraiment
cefc-fleuron-V_Rint_exo_06_P5-55	ouais mais c'est sympa
cefc-fleuron-V_Rint_exo_06_P5-31	il y a beaucoup de cours euh
cefc-fleuron-V_Rint_exo_06_P5-28	NNAAMMEE m'a envoyé un message en me disant qu'elle avait terminé le catalogue des cours
cefc-fleuron-V_Rint_exo_06_P5-47	vous avez encore du temps
cefc-fleuron-V_Rint_exo_06_P5-25	donc je vous donne un modèle
cefc-fleuron-V_Rint_exo_06_P5-3	madame ou la feuille pédagogique
cefc-fleuron-V_Rint_exo_06_P5-82	et la dame a demandé
cefc-fleuron-V_Defle_exo_05_P3-15	donc on est le vingt-et-un zéro neuf
cefc-fleuron-V_Defle_exo_05_P3-30	merci au revoir madame
cefc-fleuron-V_Defle_exo_05_P3-4	donc vous avez une pièce d'identité pour euh
cefc-fleuron-V_Defle_exo_05_P3-18	une petite signature là
cefc-fleuron-V_Defle_exo_05_P3-26	hum je revérifie hein la date de naissance
cefc-fleuron-V_Defle_exo_05_P3-12	ah oui ça c'est votre nom ça
cefc-fleuron-V_Defle_exo_05_P3-3	un diplôme oui
cefc-fleuron-V_Defle_exo_05_P3-27	quatorze onze quatre-vingt-deux
cefc-fleuron-V_Defle_exo_05_P3-23	donc le B2
cefc-fleuron-V_Defle_exo_05_P3-2	voilà bonjour madame euh je voudrais euh retirer diplôme pour un ami oui
cefc-fleuron-V_Defle_exo_05_P3-8	donc c'est pour le B2
cefc-fleuron-V_Defle_exo_05_P3-7	elle a passé le B2 d'accord
cefc-fleuron-V_Defle_exo_05_P3-24	voilà c'est hum
cefc-fleuron-V_Defle_exo_05_P3-14	c'oui est vous ça
cefc-fleuron-V_Defle_exo_05_P3-5	oui c'est diplôme de B2
cefc-fleuron-V_Rint_exo_06_P6-85	et les ECT ne ne comptent pas
cefc-fleuron-V_Rint_exo_06_P6-27	normalement votre université vous donne les cours à peu près hein
cefc-fleuron-V_Rint_exo_06_P6-12	parce que moi j'ai un document qui peut vous aider à faire le choix enfin à écrire clairement oui à écrire
cefc-fleuron-V_Rint_exo_06_P6-62	qui est professeur d'allemand hein qui est également professeur coordinateur erasmus
cefc-fleuron-V_Rint_exo_06_P6-78	c'est un accord entre les deux universités
cefc-fleuron-V_Rint_exo_06_P6-127	donc je termine je vous donne juste hein le l'email de de monsieur NNAAMMEE
cefc-fleuron-V_Rint_exo_06_P6-125	ça c'est vrai que ce serait bien de de reconfirmer avec votre université
cefc-fleuron-V_Rint_exo_06_P6-1	alors rebonjour
cefc-fleuron-V_Rint_exo_06_P6-19	il y a un contrat d'études le learning agreement
cefc-fleuron-V_Rint_exo_06_P6-32	euh j'ai fait le français et espagnol
cefc-fleuron-V_Rint_exo_06_P6-129	je vais indiquer oui à côté allemand
cefc-fleuron-V_Rint_exo_06_P6-132	et puis ils vous aideront à choisir les cours d'espagnol et d'allemand
cefc-fleuron-V_Rint_exo_06_P6-121	moi je veux faire
cefc-fleuron-V_Rint_exo_06_P6-89	parce que c'est vrai certaines certains pays n'ont pas obligatoirement besoin de points ECTS
cefc-fleuron-V_Rint_exo_06_P6-36	NNAAMMEE oui
cefc-fleuron-V_Rint_exo_06_P6-96	pour d'accord d'accord mais vous aurez besoin de passer les examens
cefc-fleuron-V_Rint_exo_06_P6-42_2	donc il y a NNAAMMEE qui peut vous aider
cefc-fleuron-V_Rint_exo_06_P6-73	c'est pas d'ici que
cefc-fleuron-V_Rint_exo_06_P6-123	d'accord très très bien
cefc-fleuron-V_Rint_exo_06_P6-34	alors je vais je vais regarder quel était le le nom de votre coordinateur
cefc-fleuron-V_Rint_exo_06_P6-3	mais je comprends pas exactement qu'
cefc-fleuron-V_Rint_exo_06_P6-105	non parce que non il faut pas aller à l'université vous pouvez travailler en
cefc-fleuron-V_Rint_exo_06_P6-67	oui parce que oui oui oui
cefc-fleuron-V_Rint_exo_06_P6-130	et puis madame NNAAMMEE c'est pour espagnol
cefc-fleuron-V_Rint_exo_06_P6-55	s'appelle A un A deux B un C E S E L V ou quelque chose oui
cefc-fleuron-V_Rint_exo_06_P6-18	et c'est votre université normalement
cefc-fleuron-V_Rint_exo_06_P6-116	votre université oui
cefc-fleuron-V_Rint_exo_06_P6-28	c'est pas exactement euh hein
cefc-fleuron-V_Rint_exo_06_P6-72	mais c'est de mon université c'est pas
cefc-fleuron-V_Rint_exo_06_P6-134	et vous pourrez euh la semaine prochaine commencer les cours
cefc-fleuron-V_Rint_exo_06_P6-39	et par contre espagnol là il pourra pas vous aider oui parce que c'est
cefc-fleuron-V_Rint_exo_06_P6-124	donc vous serez peut-être pas obligée de passer les examens effectivement si vous avez besoin si vous n'avez pas besoin de points ECTS
cefc-fleuron-V_Rint_exo_06_P6-60	je vais vous donner aussi le nom de monsieur NNAAMMEE
cefc-fleuron-V_Rint_exo_06_P6-33	français espagnol
cefc-fleuron-V_Rint_exo_06_P6-91	parce que oui en licence c'est
cefc-fleuron-V_Rint_exo_06_P6-38	c'est lui qui devrait vous aider
cefc-fleuron-V_Rint_exo_06_P6-31	quand même dans quelle discipline vous voulez étudier
cefc-fleuron-V_Rint_exo_06_P6-75	non c'est votre université qui fait le le contrat
cefc-fleuron-V_Rint_exo_06_P6-100	non parce que nous on passe
cefc-fleuron-V_Rint_exo_06_P6-92	ça fait cinq ans que
cefc-fleuron-V_Rint_exo_06_P6-120	mais moi je veux faire
cefc-fleuron-V_Rint_exo_06_P6-83	oui oui je pense que c'est différent Ecosse parce que oui je sais que j'ai besoin de l'agreement
cefc-fleuron-V_Rint_exo_06_P6-135	OK merci
cefc-fleuron-V_Rint_exo_06_P6-131	voilà hum donc vous pourrez les contacter
cefc-fleuron-V_Rint_exo_06_P6-41	mais je veux faire le niveau deux ou
cefc-fleuron-V_Rint_exo_06_P6-128_2	c'est pour l'allemand
cefc-fleuron-V_Rint_exo_06_P6-7	mais il a dit que il faut parler avec
cefc-fleuron-V_Rint_exo_06_P6-63	donc il pourra vous aider vous indiquer trouver le bon cours bien adapté par rapport à votre niveau
cefc-fleuron-V_Rint_exo_06_P6-48	OK elle s'occupe aussi des étudiants erasmus hein
cefc-fleuron-V_Rint_exo_06_P6-84	mais c'est différent parce qu'on a une année pour ceci
cefc-fleuron-V_Rint_exo_06_P6-122	mais c'est pas obligatoire
cefc-fleuron-V_Rint_exo_06_P6-108	il faut être en France
cefc-fleuron-V_Rint_exo_06_P6-51	monsieur NNAAMMEE m'a dit euh un cours euh
cefc-fleuron-V_Rint_exo_06_P6-42_1	quelque chose
cefc-fleuron-V_Rint_exo_06_P6-66	agreement c'est pas avec vous
cefc-fleuron-V_Rint_exo_06_P6-43	je vais vous donner son adresse électronique
cefc-fleuron-V_Rint_exo_06_P6-114	c'est un accord oui
cefc-fleuron-V_Rint_exo_06_P6-113	euh vous êtes restée quelques mois en France à l'université d'accord
cefc-fleuron-V_Rint_exo_06_P6-35_3	je sais que c'est NNAAMMEE
cefc-fleuron-V_Rint_exo_06_P6-53	mais c'est pour un niveau
cefc-fleuron-V_Rint_exo_06_P6-5	ou alors est-ce que vous avez vu votre professeur coordinateur ou
cefc-fleuron-V_Rint_exo_06_P6-24	et puis je ne sais pas
cefc-fleuron-V_Rint_exo_06_P6-112	vous avez validé
cefc-fleuron-V_Rint_exo_06_P6-40	il faudrait voir un professeur d'espagnol
cefc-fleuron-V_Rint_exo_06_P6-15	oui je sais qu'est-ce que je veux faire
cefc-fleuron-V_Rint_exo_06_P6-74	hein qui ils disent en fait les cours qui sont à prendre
cefc-fleuron-V_Rint_exo_06_P6-97	on vous dit passer les examens ou
cefc-fleuron-V_Rint_exo_06_P6-50	aussi je veux faire l'allemand mais est-ce que il y a un cours euh
cefc-fleuron-V_Rint_exo_06_P6-29	vous n'avez pas les codes euh
cefc-fleuron-V_Rint_exo_06_P6-99	non je je crois pas faire
cefc-fleuron-V_Rint_exo_06_P6-102	et ensuite donc a ses points ECTS
cefc-fleuron-V_Rint_exo_06_P6-8	vous en premier vous avez un petit peu parlé des cours que vous alliez choisir
cefc-fleuron-V_Rint_exo_06_P6-111	d'accord donc il y a pas vraiment un système de points ECTS du moment que vous vous êtes en séjour d'études
cefc-fleuron-V_Rint_exo_06_P6-65	et puis il faut parler avec mon université par pour le learning
cefc-fleuron-V_Rint_exo_06_P6-2	je viens inscrire dans les cours
cefc-fleuron-V_Rint_exo_06_P6-56	mais je sais pas si
cefc-fleuron-V_Rint_exo_06_P6-79	puis après vous avez votre nombre de points E C T S pour bien valider hein le nombre de points E C T S et puis ensuite avoir votre diplôme hein sans perturber euh le cursus
cefc-fleuron-V_Rint_exo_06_P6-49	elle est coordinatrice erasmus professeur
cefc-fleuron-V_Rint_exo_06_P6-30	mais vous savez un petit peu
cefc-fleuron-V_Rint_exo_06_P6-14	mais euh c'est pas beaucoup OK
cefc-fleuron-V_Rint_exo_06_P6-94	mais normalement c'est quatre ans et puis le le cinquième an c'est pour ici
cefc-fleuron-V_Rint_exo_06_P6-68	parce que c'est important c'est le document officiel
cefc-fleuron-V_Rint_exo_06_P6-58	alors euh il faudrait en discuter avec un professeur d'allemand
cefc-fleuron-V_Rint_exo_06_P6-20	oui mais j'ai reçu un email qui a dit que le learning agreement n'était pas prêt
cefc-fleuron-V_Rint_exo_06_P6-11	pas du tout
cefc-fleuron-V_Rint_exo_06_P6-16	mais je sais pas si c'est possible combien de cours
cefc-fleuron-V_Rint_exo_06_P6-26	donc là euh c'est vrai que bah
cefc-fleuron-V_Rint_exo_06_P6-101	c'est vrai que l'étudiant hein français passe ses examens
cefc-fleuron-V_Rint_exo_06_P6-37	parce que c'est euh
cefc-fleuron-V_Eras_01_Exo_P2-5	d'accord alors quel est votre problème
cefc-fleuron-V_Eras_01_Exo_P2-182	si ça vous convient
cefc-fleuron-V_Eras_01_Exo_P2-332_1	ah une page d'erreur
cefc-fleuron-V_Eras_01_Exo_P2-44	oui avec l'anglais et un peu d'italien
cefc-fleuron-V_Eras_01_Exo_P2-360	attendez je vais demander de l'aide parce que là euh ça m'étonnerait que est ce que tu sais comment on retrouve des des la présentation de l'emploi du temps machin
cefc-fleuron-V_Eras_01_Exo_P2-382	attends voir dans pédagogie
cefc-fleuron-V_Eras_01_Exo_P2-278	hum mais l'oral est beaucoup points
cefc-fleuron-V_Eras_01_Exo_P2-24	hum hum
cefc-fleuron-V_Eras_01_Exo_P2-274	mh mh oui c'est la même
cefc-fleuron-V_Eras_01_Exo_P2-104	on appelle ça de la version
cefc-fleuron-V_Eras_01_Exo_P2-222	alors les formations ça doit être ça
cefc-fleuron-V_Eras_01_Exo_P2-70	on m'a donné le nom de d'une professeur
cefc-fleuron-V_Eras_01_Exo_P2-420	il faut regarder s fascicule en ligne
cefc-fleuron-V_Eras_01_Exo_P2-139	et pour vous le thème quand vous avez un texte en espagnol vous allez le traduire en français
cefc-fleuron-V_Eras_01_Exo_P2-244	que vous avez vu de la même qui font partie de la même unité en anglais
cefc-fleuron-V_Eras_01_Exo_P2-458	demain je vais regarder à quelle heure
cefc-fleuron-V_Eras_01_Exo_P2-93	mais je ne pense pas que ça soit le plus intéressant pour vous si vous voulez travailler la traduction
cefc-fleuron-V_Eras_01_Exo_P2-320	grammaire euh langue orale
cefc-fleuron-V_Eras_01_Exo_P2-61	non pas Malaga
cefc-fleuron-V_Eras_01_Exo_P2-309_2	c'est vraiment très complexe
cefc-fleuron-V_Eras_01_Exo_P2-317	euh l'italien
cefc-fleuron-V_Eras_01_Exo_P2-352	mes chemins habituels euh
cefc-fleuron-V_Eras_01_Exo_P2-290	commerce international marketing management
cefc-fleuron-V_Eras_01_Exo_P2-215	plus UFR
cefc-fleuron-V_Eras_01_Exo_P2-95	alors dites moi je vous laisse euh
cefc-fleuron-V_Eras_01_Exo_P2-54	OK donc vous entrez en quatrième année
cefc-fleuron-V_Eras_01_Exo_P2-415	parce que là je trouve ça effroyable
cefc-fleuron-V_Eras_01_Exo_P2-433	hum on on peut
cefc-fleuron-V_Eras_01_Exo_P2-65	eh oui hum
cefc-fleuron-V_Eras_01_Exo_P2-343	vous trouvez mais euh je trouve
cefc-fleuron-V_Eras_01_Exo_P2-307	c'est pas là hein
cefc-fleuron-V_Eras_01_Exo_P2-427	oui oui mais c'est la fonction euh anglais
cefc-fleuron-V_Eras_01_Exo_P2-22	vous avez des papiers sur le cours
cefc-fleuron-V_Eras_01_Exo_P2-77	vous m'attendez deux minutes parce que d'habitude j'ai mon ordinateur portable
cefc-fleuron-V_Eras_01_Exo_P2-387_2	un moment
